{
  "schema_version": 1,
  "slug": "garment-manufacturer-tirupur",
  "template": "manufacturer",
  "meta": {
    "name": "Garment Manufacturer Tirupur",
    "category": "Manufacturer",
    "tagline": "Leading garment manufacturers and suppliers in Tiruppur",
    "description": "\nDoor No:14, 4th St, K V R Nagar, Karuvampalayam, Tiruppur, Andipalayam, Tamil Nadu 641604",
    "locale": [
      "en"
    ]
  },
  "theme": {
    "primary": "#0A1628",
    "accent": "#1889F6",
    "font_head": "Montserrat",
    "font_body": "Inter"
  },
  "contact": {
    "phone": "09626660098",
    "whatsapp": "09626660098",
    "address": "\nDoor No:14, 4th St, K V R Nagar, Karuvampalayam, Tiruppur, Andipalayam, Tamil Nadu 641604",
    "geo": {
      "lat": 11.1085,
      "lng": 77.3411
    },
    "hours": {
      "mon_sat": "09:30–18:30",
      "sun": "closed"
    },
    "socials": {
      "instagram": "",
      "facebook": ""
    }
  },
  "sections": [
    {
      "type": "hero",
      "headline": "Custom Garment Manufacturing & Apparel Solutions",
      "sub": "Knitwear, sportswear, fashion wear, and corporate uniforms engineered for quality.",
      "cta": "Submit Inquiry",
      "image": ""
    },
    {
      "type": "about",
      "body": "Garment Manufacturer Tirupur is a full-service production house in Tiruppur. We support global retailers, fashion brands, and corporate clients with state-of-the-art knitting, dyeing, printing, and sewing facilities.",
      "stats": [
        {
          "k": "Rating",
          "v": "5.0/5"
        },
        {
          "k": "Reviews",
          "v": "19"
        },
        {
          "k": "Capacity",
          "v": "50k/mo"
        }
      ]
    },
    {
      "type": "catalog",
      "items": [
        {
          "name": "Product Line #1",
          "desc": "Fully integrated knitwear production facility",
          "moq": "500 pcs",
          "price": null
        },
        {
          "name": "Product Line #2",
          "desc": "Ethical labor and eco-friendly practices",
          "moq": "500 pcs",
          "price": null
        },
        {
          "name": "Product Line #3",
          "desc": "Fast turnarounds with low B2B MOQs",
          "moq": "500 pcs",
          "price": null
        }
      ]
    },
    {
      "type": "capabilities",
      "items": [
        "Quality Garments",
        "Export Packaging",
        "Timely Deliveries",
        "Ethical Audited Factory"
      ]
    },
    {
      "type": "testimonials",
      "items": [
        {
          "quote": "Excellent customer experience with Garment Manufacturer Tirupur. Highly recommended!",
          "by": "Kumar S. (Local Client)"
        }
      ]
    }
  ],
  "seo": {
    "title": "Garment Manufacturer Tirupur | Custom Apparel Factory",
    "meta_description": "Premier garment factory in Tiruppur, India. Custom clothing manufacturing, apparel exports, high-quality production.",
    "keywords": [
      "manufacturer",
      "tiruppur"
    ],
    "localbusiness_jsonld": true
  },
  "source": {
    "place_ref": "Garment+Manufacturer+Tirupur",
    "generated_by": "claude-manual",
    "human_approved": false
  }
}