{
  "schema_version": 1,
  "slug": "test-business",
  "template": "manufacturer",
  "meta": {
    "name": "Tiruppur Cotton Mills",
    "category": "Garment Manufacturer",
    "tagline": "Premium B2B Garment Manufacturing & Exports",
    "description": "Established in 2005, Tiruppur Cotton Mills is a leading supplier of export-quality knitwear, specializing in organic cotton products and ethical manufacturing processes.",
    "locale": ["en", "ta"]
  },
  "theme": {
    "preset": "navy",
    "primary": "#0f172a",
    "accent": "#0284c7",
    "font_head": "Montserrat",
    "font_body": "Inter"
  },
  "contact": {
    "phone": "+919876543210",
    "whatsapp": "+919876543210",
    "email": "info@tiruppurcotton.com",
    "address": "12, Avinashi Road, Tiruppur, Tamil Nadu 641603",
    "geo": { "lat": 11.1085, "lng": 77.3411 },
    "hours": { "mon_sat": "09:00–18:00", "sun": "closed" },
    "gbp_url": "https://maps.google.com/?q=Tiruppur+Cotton+Mills",
    "socials": { "instagram": "https://instagram.com", "facebook": "https://facebook.com" }
  },
  "sections": [
    { "type": "hero", "headline": "Premium B2B Garment Manufacturing", "sub": "Export-quality knitwear manufactured ethically in Tiruppur. Standard-compliant GOTS organic apparel.", "cta": "Request Quote", "image": "assets/hero.jpg" },
    { "type": "about", "body": "We specialize in custom knitwear for brands worldwide. Over 15 years of industry experience.", "stats": [ { "k": "Since", "v": "2005" }, { "k": "Capacity", "v": "80k/mo" } ] },
    { "type": "capabilities", "items": ["Knitting", "Eco-Dyeing", "Apparel Cutting", "Strict QA Inspections"] },
    { "type": "gallery", "images": ["assets/gallery-1.jpg", "assets/gallery-2.jpg"] },
    { "type": "testimonials", "items": [ { "quote": "Excellent quality garments and very professional team.", "by": "Ramesh Kumar" } ] }
  ],
  "seo": {
    "title": "Tiruppur Cotton Mills | Garment Manufacturer",
    "meta_description": "Ethical and high-quality knitwear garment exporter based in Tiruppur.",
    "keywords": ["knitwear", "tiruppur manufacturer", "garments"]
  },
  "source": {
    "generated_by": "claude-manual",
    "human_approved": false
  }
}
